### ISSUE TITLE
comma inserted for custom DNS server

### ISSUE THREAD

**Issue by jungle-boogie** [trueos/trueos-core#259]
Hello,

`12.0-CURRENT FreeBSD 12.0-CURRENT #11 8b9df91(drm-next-4.7): Sat Dec 24 15:17:28 UTC 2016`

Something within using custom DNS settings, with custom DNS server (not public) results in unnecessary comma.

0. Start the network manager in the pc-tray
1. go to the `network configuration (advanced)` tab
2. click enable custom DNS
3. DNS 1: `192.168.0.17`
4. DNS 2: public server -> 8.8.8.4.4
5. ok
6. apply
7. close
8. restart the network in the pc-tray.

--from terminal `% cat /etc/resolv.conf`:
```
Generated by resolvconf
nameserver 192.168.0.17,
nameserver 8.8.4.4
```

The comma is invalid and therefore, DNS requests skip the preferred server:
```
% sudo /usr/local/sbin/tcpdump port 53 -i wlan0
Password:
tcpdump: verbose output suppressed, use -v or -vv for full protocol decode
listening on wlan0, link-type EN10MB (Ethernet), capture size 262144 bytes
22:01:33.227405 IP 192.168.0.10.20064 > google-public-dns-b.google.com.domain: 42793+ A? freeswitch.org. (32)
22:01:33.227682 IP 192.168.0.10.62712 > google-public-dns-b.google.com.domain: 19839+ PTR? 10.0.168.192.in-addr.arpa. (43)
22:01:33.266915 IP google-public-dns-b.google.com.domain > 192.168.0.10.62712: 19839 NXDomain 0/0/0 (43)
22:01:33.267125 IP 192.168.0.10.41712 > google-public-dns-b.google.com.domain: 19602+ PTR? 4.4.8.8.in-addr.arpa. (38)
22:01:33.287073 IP google-public-dns-b.google.com.domain > 192.168.0.10.20064: 42793 1/0/0 A 209.105.235.6 (48)
22:01:33.287136 IP 192.168.0.10.26948 > google-public-dns-b.google.com.domain: 2557+ AAAA? freeswitch.org. (32)
```

**Comment by pkgdemon** [comment]
Fixed in https://github.com/trueos/pc-networkmanager/commit/f6f390cdbe9787cb9cffb94fe5603c66a3b2f31a
